{
  "schema_version": "obs.probe_result.v1",
  "probe_id": "probe.scheduler_snapshot",
  "probe_plan_id": "PP001",
  "result_kind": "not_executed_missing_capability",
  "executor": "adc",
  "executed": false,
  "safety_decision": "deny",
  "capability_status": "unavailable",
  "status": "failed_missing_capability",
  "produced_refs": [],
  "produced_facts": [],
  "hypothesis_updates": [],
  "data_quality": {
    "dropped": false,
    "drop_count": 0,
    "throttled": false,
    "missing": ["scheduler latency unavailable without required kernel support"],
    "truncated": false,
    "clock_confidence": "medium",
    "notes": []
  }
}
